CREDIT:, North London Waste Authority, https://www.nlwa.gov.uk/our-office, By: Abdul
Aerosol,https://www.nlwa.gov.uk/reducereuserecycle/recycle/whatcanwerecycle/aerosol,"spray cans, body sprays, spray deodorant","As long as they are fully empty, these can be recycled at home."
Aftershave bottles,https://www.nlwa.gov.uk/reducereuserecycle/recycle/whatcanwerecycle/aftershave-bottles,aftershave bottles,All colours of glass can be recycled at home. Please just ensure that bottles are empty.
Aluminium cans,https://www.nlwa.gov.uk/reducereuserecycle/recycle/whatcanwerecycle/aluminium-cans,aluminium cans,These can be recycled at home. Please empty and rinse but do not crush or flatten cans.
Aluminium foil,https://www.nlwa.gov.uk/reducereuserecycle/recycle/whatcanwerecycle/aluminium-foil,"Tin foil, foil",Items such as clean food trays and foil wrapping on biscuits can be recycled in your mixed recycling bin at home. Please make sure that these items don't contain any grease or food residue. You can also recycle clean foil at your local reuse and recycling centre.
Animal Bedding,https://www.nlwa.gov.uk/reducereuserecycle/recycle/whatcanwerecycle/animal-bedding,animal bedding,"Fabric used for pet bedding or padded animal beds need to be put in your general waste. Pet bedding such as sawdust and chippings also need to be put in your general waste bin and not in the garden or kitchen waste. This is because they contain urine and faeces and do not meet the acceptance criteria for our composting facilities. Alternatively, you could put the bedding into your own home composting bin. Residents who wish to compost it at home should remove faeces (to prevent disease) and only add small quantities to ensure there’s a good carbon/nitrogen balance."
Anti-freeze bottle,https://www.nlwa.gov.uk/reducereuserecycle/recycle/whatcanwerecycle/anti-freeze-bottle,Anti-freeze bottle,"If the bottle is empty, it can be recycled at home. Plastic bottles containing strong chemicals that are highly poisonous and hazardous to staff and can damage the recycling equipment. Check the bottle for disposal instructions."
Asbestos,https://www.nlwa.gov.uk/reducereuserecycle/recycle/whatcanwerecycle/asbestos,asbestos,"Asbestos is a toxic material that was once used to make insulation and fireproofing material in construction, it is classed as hazardous waste. Household asbestos can be dropped off by appointment only to our .You can also arrange for a free collection by the City of London Hazardous Waste Service.Hornsey Street Reuse and Recycling Centre wrapped up in heavy duty plastic wrapping (household rubble sacks that can be bought from supermarkets). We do not accept unwrapped asbestos. Call 020 8884 5645 to make an appointment. Site staff will need to know how much asbestos you need to dispose of and check that there is enough space in the asbestos container."
Ash,https://www.nlwa.gov.uk/reducereuserecycle/recycle/whatcanwerecycle/ash,ash,"Small amounts of cold ash or cinders from an open fire can help to keep slugs and snails off your vegetable patch. Once cooled, you can also put small amounts into your general waste bin at home. Never put hot ashes into a bin."
Baby food jars,https://www.nlwa.gov.uk/reducereuserecycle/recycle/whatcanwerecycle/baby-food-jars,baby food jars,All colours of glass can be recycled at home. Please just empty and rinse.
Baby items,https://www.nlwa.gov.uk/reducereuserecycle/recycle/whatcanwerecycle/baby-items,baby items,"If they're in good condition, baby items could be sold online, taken to a charity shop or given away on Freecycle or Freegle. If broken or not in good condition, they can be disposed of in your general waste bin."
Baked goods,https://www.nlwa.gov.uk/reducereuserecycle/recycle/whatcanwerecycle/baked-goods,baked goods,"If your local council provides a food waste collection service where you live, you can dispose of food waste in your food bin. All types of food can go in the bin but please do not add: any kind of plastic or packaging, liquids including liquid fat/oil, and garden waste including wood or cut flowers. If you do not have a food waste service, cooked foods like this would need to go in your general waste bin."
Bathroom cleaner bottles,https://www.nlwa.gov.uk/reducereuserecycle/recycle/whatcanwerecycle/bathroom-cleaner-bottles,bathroom cleaner bottles,"These can be recycled at home. Empty and rinse well, remove cardboard packaging but labels can be left on."
Bathroom suites,https://www.nlwa.gov.uk/reducereuserecycle/recycle/whatcanwerecycle/bathroom-suites,bathroom suits,"If the bathroom suite is in good condition, it could be sold or donated for reuse or to charity. Some local authorities and charities might even collect reusable items from your home. Alternatively, you could take it to one of north London's reuse and recycling centres (RRC) or make use of your local council's bulky collection service."
Batteries,https://www.nlwa.gov.uk/reducereuserecycle/recycle/whatcanwerecycle/batteries,household batteries,"Household batteries are difficult products to recycle because they are made from so many different materials and are hazardous too - they need specialist handling. The specification for the Materials Recovery . You can take used batteries to be recycled at certain retailers. From February 2010, any shop selling more than 32kg of batteries a year (approximately 345 x four-packs of AA batteries each year) have to provide battery recycling collection facilities in-store. Lithium batteries (used in things like laptops) must be placed in a plastic bag before going into a battery recycling bin because they cause fire risk when mixed with other battery types. Facilities (MRFs), which sort north Londoners’ recycling into the different individual materials does not include batteries. The environmental permits for the MRFs that we use also do not permit them to accept hazardous waste, so please do not include batteries in the recycling. If found in the recycling batteries are classified as a contaminant in recycling loads.Find your nearest battery recycling point by visiting the Recycle Now website."
Beans,https://www.nlwa.gov.uk/reducereuserecycle/recycle/whatcanwerecycle/beans,beans,"If your local council provides a food waste collection service where you live, you can dispose of food waste in your food bin. All types of food can go in the bin but please do not add: any kind of plastic or packaging, liquids including liquid fat/oil, and garden waste including wood or cut flowers. If you do not have a food waste service, cooked foods like this would need to go in your general waste bin."
Bedding,https://www.nlwa.gov.uk/reducereuserecycle/recycle/whatcanwerecycle/bedding,bedding,"Sheets and blankets in good condition can be sold online, given away to or donated to charity. Alternatively, they can be deposited in one of north London's on-street collection banks or taken to a reuse and recycling centre (RRC) where they will be sorted and recycled. Duvets or pillows unfortunately cannot be recycled and would need to be taken to an RRC."
Beds,https://www.nlwa.gov.uk/reducereuserecycle/recycle/whatcanwerecycle/beds,bed,"If furniture is in good condition, it could be sold or donated for reuse or to charity. Some local authorities and charities might even collect reusable items from your home. Please note that any furniture containing upholstery needs to have a fire label on it, or it cannot be reused (see Reuse Network website page for more information). Alternatively, you could take it to one of north London's reuse and recycling centres (RRC) or make use of your local council's bulky collection service."
Beer Bottles,https://www.nlwa.gov.uk/reducereuserecycle/recycle/whatcanwerecycle/beer-bottles,beer bottles,All colours of glass can be recycled at home. Please just empty and rinse.
Bikes,https://www.nlwa.gov.uk/reducereuserecycle/recycle/whatcanwerecycle/bikes,"bikes, bicycle, bicycles","Please take bikes that could be used again to a north London's reuse and recycling centre (RRC). They will be taken to be sold at our reuse shop, Second Time Around, at Kings Road RRC. If you have a bike that cannot be used again, take it to an RRC for recycling/disposal."
Biros,https://www.nlwa.gov.uk/reducereuserecycle/recycle/whatcanwerecycle/biros,biros,"We can't recycle pens so please put them in your general waste. Alternatively, any brand of pen, correction fluid pots, markers and highlighters can be recycled through TerraCycle where there are a number of drop-off locations."
Birthday cards,https://www.nlwa.gov.uk/reducereuserecycle/recycle/whatcanwerecycle/birthday-cards,"birthday cards, greeting cards, Christmas cards","As long as they are not shiny and don't have glitter on them, gift cards can be recycled. Shiny/glittery ones need to go in the general waste bin."
Biscuit tins,https://www.nlwa.gov.uk/reducereuserecycle/recycle/whatcanwerecycle/biscuit-tins,biscuit tins,These can be recycled at home. Please just make sure they are clean. Labels can be left on.
Biscuit trays,https://www.nlwa.gov.uk/reducereuserecycle/recycle/whatcanwerecycle/biscuit-trays,biscuit trays,These can be recycled at home. Please just make sure they are clean. Labels can be left on.
Biscuits,https://www.nlwa.gov.uk/reducereuserecycle/recycle/whatcanwerecycle/biscuits,biscuits,"If your local council provides a food waste collection service where you live, you can dispose of food waste in your food bin. All types of food can go in the bin but please do not add: any kind of plastic or packaging, liquids including liquid fat/oil, and garden waste including wood or cut flowers. If you do not have a food waste service, cooked foods like this would need to go in your general waste bin."
Black bags,https://www.nlwa.gov.uk/reducereuserecycle/recycle/whatcanwerecycle/black-bags,black bags,"Black bags can be used to store/transport general waste but should not be used to store recycling. The north London boroughs have to deal with the problem of waste wrongly placed in the recycling bin, including waste in black bin bags. For the avoidance of doubt, all black bags found in recycling bins will be disposed of."
Black food trays,https://www.nlwa.gov.uk/reducereuserecycle/recycle/whatcanwerecycle/black-food-trays,black food trays,"All the material we list in the information provided to households as ‘acceptable for recycling’ is included in the specification list of materials accepted by the Materials Recovery Facilities (MRFs) that we use to sort the recycling from north London homes, so it can be recycled. Not every local authority includes black trays in their mixed recycling. However, in north London, black plastic trays can be put into the recycling. This is because the specification for the MRFs, which sort north Londoners’ recycling into the different individual materials, includes black plastic. So, if black plastic is clean, it is not a contaminant in recycling loads."
Blankets,https://www.nlwa.gov.uk/reducereuserecycle/recycle/whatcanwerecycle/blankets,blankets,"Sheets and blankets in good condition can be sold online, given away or donated to charity. Alternatively, they can be deposited in one of north London's on-street textile collection banks or taken to a reuse and recycling centre (RRC) where they will be sorted."
Bleach bottles,https://www.nlwa.gov.uk/reducereuserecycle/recycle/whatcanwerecycle/bleach-bottles,bleach bottles,"These can be recycled at home. Empty and rinse well, remove cardboard packaging but labels can be left on."
Bones,https://www.nlwa.gov.uk/reducereuserecycle/recycle/whatcanwerecycle/bones,bones,"If your local council provides a food waste collection service where you live, you can dispose of food waste in your food bin. All types of food can go in the bin but please do not add: any kind of plastic or packaging, liquids including liquid fat/oil, and garden waste including wood or cut flowers. If you do not have a food waste service, the bones would need to go in your general waste bin."
Books,https://www.nlwa.gov.uk/reducereuserecycle/recycle/whatcanwerecycle/books,books,"Books that are in good condition could be sold or reused by donating to charity, or taking to a north London reuse and recycling centre. However, if they are not reusable, books can go into your recycling bin. Please just make sure they have no dirt, foodstuffs, grease or paint on them (if so, they would need to go in your general waste bin)."
Boots,https://www.nlwa.gov.uk/reducereuserecycle/recycle/whatcanwerecycle/boots,boots,"Good quality clothing or shoes could be sold online, given away or donated to charity. Alternatively, even if they are not in good condition, they can be deposited in one of north London's on-street collection banks or taken to a reuse and recycling centre (RRC)."
Bottles,https://www.nlwa.gov.uk/reducereuserecycle/recycle/whatcanwerecycle/bottles,bottles,"Plastic and glass bottles can be recycled at home. Empty and rinse well, remove cardboard packaging but labels can be left on"
Bras,https://www.nlwa.gov.uk/reducereuserecycle/recycle/whatcanwerecycle/bras,bras,Bras in 'new' condition which have not been worn can be sold online or given away. Some charity shops will accept used bras or you can take them to one of north London's on-street collection banks or to a reuse and recycling centre (RRC) to be reused or recycled.
Bread,https://www.nlwa.gov.uk/reducereuserecycle/recycle/whatcanwerecycle/bread,bread,"If your local council provides a food waste collection service where you live, you can dispose of food waste in your food bin. All types of food can go in the bin but please do not add: any kind of plastic or packaging, liquids including liquid fat/oil, and garden waste including wood or cut flowers. If you do not have a food waste service, cooked foods like this would need to go in your general waste bin."
Bric a brac,https://www.nlwa.gov.uk/reducereuserecycle/recycle/whatcanwerecycle/bric-brac,bric a brac,"Small household items that are in good condition could be sold or reused by donating to charity, or taking to a north London reuse and recycling centre. If the item is not reusable, it can be disposed of in your general waste bin."
Bricks,https://www.nlwa.gov.uk/reducereuserecycle/recycle/whatcanwerecycle/bricks,bricks,"This can be taken to one of north London's reuse and recycling centres (RRC) where you can recycle hardcore material such as rubble, concrete and soil. There is a limit to the number of bags of hardcore each household can take to be recycled. Read more on our Hardcore and rubble page."
Brochures,https://www.nlwa.gov.uk/reducereuserecycle/recycle/whatcanwerecycle/brochures,brochures,"These can be recycled at home. Please just make sure they have no dirt, foodstuffs, grease or paint on them."
Brown Paper,https://www.nlwa.gov.uk/reducereuserecycle/recycle/whatcanwerecycle/brown-paper,brown paper,"This can be recycled at home. Please just make sure it has no dirt, foodstuffs, grease or paint on it."
Brown plant pots,https://www.nlwa.gov.uk/reducereuserecycle/recycle/whatcanwerecycle/brown-plant-pots,brown flower pots,"These are not included in the specification for the Materials Recovery Facilities (MRFs), which sort the recycling into different materials. They are not accepted because plant pots are made of a type of plastic that the MRFs don’t have a recycling outlet for, i.e. there’s nowhere for the MRFs to send them to where they can economically be made into new products. Some garden centres will take back previously used plant pots for re-use. Alternatively please include them in the general waste bin."
Bubble wrap,https://www.nlwa.gov.uk/reducereuserecycle/recycle/whatcanwerecycle/bubble-wrap,bubble wrap,Thin plastic like bubble wrap is made from low-quality plastic and is not recycled. Please reuse it or put it in your general waste.
Building materials,https://www.nlwa.gov.uk/reducereuserecycle/recycle/whatcanwerecycle/building-materials,building materials,"Small amounts of DIY waste and building materials can be taken to one of north London's reuse and recycling centres (RRC) where you can recycle hardcore material such as rubble, concrete and soil. Each north London household can take up to six standard rubble sacks of soil and six standard rubble sacks of rubble to an RRC each month. A standard rubble sack is 20” by 30” sack or equivalent. Commercial building waste cannot be taken to an RRC. For larger projects we advise hiring a skip, most skip providers will usually sort and recycle materials for you."
Bulky Household Items,https://www.nlwa.gov.uk/reducereuserecycle/recycle/whatcanwerecycle/bulky-household-items,bulky household items,"If they're in good condition, bulky household items could be sold online, taken to a charity shop or given away on Freecycle or Freegle. Some local authorities and charities might even collect reusable items from your home. To recycle large waste electrical items you can book a free collection from your doorstep through Clearabee. For more information visit our page about recycling electrical items. You can also take reusable furniture to one of north London’s reuse and recycling centres (RRCs) where they can be put aside and sold in our reuse shop, Second Time Around. If your item is not reusable, you can take it to an RRC where it will be recycled where possible, or make use of your local council's bulky collection service. There can be a charge for the bulky waste collection services."
Business Waste,https://www.nlwa.gov.uk/reducereuserecycle/recycle/whatcanwerecycle/business-waste,"business waste, commercial waste, trade waste,",Any property that is commercially rated must pay for the removal of their waste by a licensed waste carrier. You can either ask your local council or a private waste disposal/recycling company to collect it or take it to a private waste disposal/recycling facility yourself. Check out our business pages for more information: http://wiseuptowaste.org.uk/businesses/
Buttons,https://www.nlwa.gov.uk/reducereuserecycle/recycle/whatcanwerecycle/buttons,buttons,"Keep buttons yourself to update old clothes, try giving them away or selling them online, or donate them to a charity shop."
Cakes,https://www.nlwa.gov.uk/reducereuserecycle/recycle/whatcanwerecycle/cakes,cakes,"If your local council provides a food waste collection service where you live, you can dispose of food waste in your food bin. All types of food can go in the bin but please do not add: any kind of plastic or packaging, liquids including liquid fat/oil, and garden waste including wood or cut flowers. If you do not have a food waste service, cooked foods like this would need to go in your general waste bin."
Car batteries,https://www.nlwa.gov.uk/reducereuserecycle/recycle/whatcanwerecycle/car-batteries,car batteries,Car batteries can be taken to one of north London's reuse and recycling centres (RRC) where they can be recycled. Do handle with care as car batteries contain acid. You can also ask the garage to take back the old one when you purchase a new battery.
Cardboard boxes,https://www.nlwa.gov.uk/reducereuserecycle/recycle/whatcanwerecycle/cardboard-boxes,"cardboard boxes, boxes, dishwasher tablets boxes,","These can be recycled at home. Please just make sure they have no dirt, foodstuffs, grease or paint on them. It is also helpful if you remove excess sticky tape (a small amount is okay)."
Carpet,https://www.nlwa.gov.uk/reducereuserecycle/recycle/whatcanwerecycle/carpet,carpet,You can dispose of this at one of north London's reuse and recycling centres (RRC) or make use of your local council's bulky collection service.
Carrier bags,https://www.nlwa.gov.uk/reducereuserecycle/recycle/whatcanwerecycle/carrier-bags,"carrier bags, plastic bag, plastic bags","The quality of plastic in carrier bags is relatively poor compared to pots and tubs. You can put them in with your recycling, but at the moment, we have not been able to find a suitable re-processor to buy them so they will not be recycled. We only sell materials to re-processors who can provide us information about the end destination of the recycling.The best thing to do with carrier bags is reuse them as much as possible in the first instance, and try to use reusable bags instead. Some supermarkets will recycle carrier bags. Use the Recycle Now locator to search for a carrier bag recycling point near you."
Cars,https://www.nlwa.gov.uk/reducereuserecycle/recycle/whatcanwerecycle/cars,cars,"If your car is in a road-worthy condition, you may be able to sell it privately or trade-in when you buy a new one. If your car is at the end of its life, you may find a local scrap dealer who is willing to buy it from you or you could donate it to charity via schemes such as Charity Car and Giveacar."
Cartons,https://www.nlwa.gov.uk/reducereuserecycle/recycle/whatcanwerecycle/cartons,"cartons, drink cartons, tetra pak","Most cartons can be recycled in north London. Please give items a quick rinse, make sure they have no dirt, foodstuffs, grease or paint on them, and remove plastic tops or straws. Items that can be recycled .Drinks cartons e.g. juice or milk Food cartons e.g. soup Items that cannot be recycled .Laminated plastic food/drink pouches e.g. baby food, cat food, or coffee pouches. However, some laminated pouches can be recycled through Terracycle."
Cassette players,https://www.nlwa.gov.uk/reducereuserecycle/recycle/whatcanwerecycle/cassette-players,cassette players,"Small electrical items that are in good condition could be sold or donated for reuse or to charity. If the items is not reusable, it can be taken to an on-street electricals collection bank or to one of north London's reuse and recycling centres (RRC) to be recycled. For more information visit our page about recycling electrical items."
Cassette tapes,https://www.nlwa.gov.uk/reducereuserecycle/recycle/whatcanwerecycle/cassette-tapes,cassette tapes,"Some charity shops might take cassette tapes but many will not. If you are unable to find any other way to reuse them, cassette tapes will have to go in the general waste."
Cat food pouches,https://www.nlwa.gov.uk/reducereuserecycle/recycle/whatcanwerecycle/cat-food-pouches,cat food pouches,"Laminated food pouches are made from a combination of aluminium and plastic. We do not have the technology to recycle them in north London. Some laminated pouches can be recycled through TerraCycle where there are a number of drop-off locations. Alternatively, please put them in your general waste."
Cat litter,https://www.nlwa.gov.uk/reducereuserecycle/recycle/whatcanwerecycle/cat-litter,"cat litter, pet litter",Cat litter cannot be recycled so put it in your general waste (non recyclable) bin at home. There are compostable varieties of cat litter but it cannot go into the food or garden waste collected by the council. This is because it could contain urine and faeces and therefore does not meet the acceptance criteria for our composting facilities. Residents who wish to compost it at home should remove faeces (to prevent disease) and only add small quantities to ensure there’s a good carbon/nitrogen balance.
Catalogues,https://www.nlwa.gov.uk/reducereuserecycle/recycle/whatcanwerecycle/catalogues,catalogues,"These can be recycled at home. Please just make sure they have no dirt, foodstuffs, grease or paint on them."
CD Players,https://www.nlwa.gov.uk/reducereuserecycle/recycle/whatcanwerecycle/cd-players,cd players,"Small electrical items that are in good condition could be sold or donated for reuse or to charity. If the items is not reusable, it can be taken to an on-street electricals collection bank or to one of north London's reuse and recycling centres (RRC) to be recycled. For more information visit our page about recycling electrical items."
CDs,https://www.nlwa.gov.uk/reducereuserecycle/recycle/whatcanwerecycle/cds,CDs,"If they're in good condition, CDs could be sold online, taken to a charity shop or given away on Freecycle or Freegle or commercial websites. If you cannot find any way to reuse them please dispose of them in the general rubbish bin."
Ceramics,https://www.nlwa.gov.uk/reducereuserecycle/recycle/whatcanwerecycle/ceramics,"ceramics, Earthenware, crockery","If they're in good condition, ceramics/crockery/earthenware could be sold online, taken to a charity shop or given away on Freecycle or Freegle. If broken or not in good condition, they can be taken to one of north London's reuse and recycling centres (RRCs) where they can go in the 'hardcore and rubble' skip."
Cereal boxes,https://www.nlwa.gov.uk/reducereuserecycle/recycle/whatcanwerecycle/cereal-boxes,cereal boxes,"These can be recycled at home. Please just make sure they have no dirt, foodstuffs, grease or paint on them."
Chairs,https://www.nlwa.gov.uk/reducereuserecycle/recycle/whatcanwerecycle/chairs,chair,"If furniture is in good condition, it could be sold or donated for reuse or to charity. Some local authorities and charities might even collect reusable items from your home. Please note that any furniture containing upholstery needs to have a fire label on it, or it cannot be reused (see Reuse Network for more information). Alternatively, you could take it to one of north London's reuse and recycling centres (RRC) or make use of your local council's bulky collection service."
Chemicals,https://www.nlwa.gov.uk/reducereuserecycle/recycle/whatcanwerecycle/chemicals,chemicals,"Chemicals are classed as 'hazardous' waste. Make sure that container lids are secured, and if possible, that containers have a label. You will need to use the free City of London Hazardous Waste Service."
