Paint,https://www.nlwa.gov.uk/reducereuserecycle/recycle/whatcanwerecycle/paint,leftover paint,"Paint that could be reused can be taken to some of north London's reuse and recycling centres (opens in new window) where it can be recycled. However, at present, due to COVID-19 restrictions, we cannot guarantee that all of it will be reused.If paint is too old to be reused, there are various ways to dispose of it:Water-based paint (emulsion)Take it to a north London reuse and recycling centre (RRC)If you live in Barnet, Camden, Enfield, Hackney, Islington or Waltham Forest, use the free City of London Hazardous Waste Service (opens in new window).If you fully dry it out, emulsion can be disposed of in your normal rubbish bin. To dry the paint, take the lid off, add some sand or sawdust and then leave for several weeks.Oil-based paint (gloss)If you live in Barnet, Camden, Enfield, Hackney, Islington or Waltham Forest, use the free City of London Hazardous Waste Service.Take it to a north London reuse and recycling centre (RRC) Paint that could be reused can be taken to some of north London's reuse and recycling centres (opens in new window) where it can be recycled. However, at present, due to COVID-19 restrictions, we cannot guarantee that all of it will be reused.If paint is too old to be reused, there are various ways to dispose of it:Water-based paint (emulsion)Take it to a north London reuse and recycling centre (RRC)If you live in Barnet, Camden, Enfield, Hackney, Islington or Waltham Forest, use the free City of London Hazardous Waste Service (opens in new window).If you fully dry it out, emulsion can be disposed of in your normal rubbish bin. To dry the paint, take the lid off, add some sand or sawdust and then leave for several weeks.Oil-based paint (gloss)If you live in Barnet, Camden, Enfield, Hackney, Islington or Waltham Forest, use the free City of London Hazardous Waste Service.Take it to a north London reuse and recycling centre (RRC) Paint that could be reused can be taken to some of north London's reuse and recycling centres (opens in new window) where it can be recycled. However, at present, due to COVID-19 restrictions, we cannot guarantee that all of it will be reused.If paint is too old to be reused, there are various ways to dispose of it:Water-based paint (emulsion)Take it to a north London reuse and recycling centre (RRC)If you live in Barnet, Camden, Enfield, Hackney, Islington or Waltham Forest, use the free City of London Hazardous Waste Service (opens in new window).If you fully dry it out, emulsion can be disposed of in your normal rubbish bin. To dry the paint, take the lid off, add some sand or sawdust and then leave for several weeks.Oil-based paint (gloss)If you live in Barnet, Camden, Enfield, Hackney, Islington or Waltham Forest, use the free City of London Hazardous Waste Service.Take it to a north London reuse and recycling centre (RRC)"
"Paint brushes, rollers and rags",https://www.nlwa.gov.uk/reducereuserecycle/recycle/whatcanwerecycle/paint-brushes-rollers-and-rags,"Paint brush, paint roller, paint rag","Unwanted paint brushes and rollers that are clean and in a reusable state could be given away locally or donated for reuse through online sites such as Freecycle or Gumtree. However, if they are not fit for reuse, please dispose of them in your general waste bin. These items are usually coated in paint and made from a mix of materials, which makes them difficult and costly to separate for recycling. There is currently no recycling option for these items in north London. Rags that are heavily soiled with paint or thinners should be disposed of in the general waste bin."
Paint container,https://www.nlwa.gov.uk/reducereuserecycle/recycle/whatcanwerecycle/paint-container,paint container,"Empty metal paint cans can be taken to one of north London's reuse and recycling centres where they can be recycled. However, plastic paint cans cannot be recycled so should be placed in your general waste."
Paint thinners,https://www.nlwa.gov.uk/reducereuserecycle/recycle/whatcanwerecycle/paint-thinners,paint thinners,This is classed as 'hazardous' waste so should be disposed of carefully. You will need to use the free City of London Hazardous Waste Service.
Paper towels,https://www.nlwa.gov.uk/reducereuserecycle/recycle/whatcanwerecycle/paper-towels,paper towels,"Even if it’s clean, paper towel is not recyclable. This is because it is made from paper with very short fibres - and in order to be useful for recycling into something new, the fibres would need to be longer. Paper can only be recycled a certain number of times because the fibres get shorter each time. Please put paper towel in the general waste."
Pasta,https://www.nlwa.gov.uk/reducereuserecycle/recycle/whatcanwerecycle/pasta,pasta,"If your local council provides a food waste collection service where you live, you can dispose of food waste in your food bin. All types of food can go in the bin but please do not add: any kind of plastic or packaging, liquids including liquid fat/oil, and garden waste including wood or cut flowers. If you do not have a food waste service, cooked foods like this would need to go in your general waste bin."
Pastries,https://www.nlwa.gov.uk/reducereuserecycle/recycle/whatcanwerecycle/pastries,food waste,"If your local council provides a food waste collection service where you live, you can dispose of food waste in your food bin. All types of food can go in the bin but please do not add: any kind of plastic or packaging, liquids including liquid fat/oil, and garden waste including wood or cut flowers. If you do not have a food waste service, cooked foods like this would need to go in your general waste bin."
Pencils,https://www.nlwa.gov.uk/reducereuserecycle/recycle/whatcanwerecycle/pencils,pencils,"We can't recycle pencils because they are made up of a number of different materials, so please put them in your general waste."
Pens,https://www.nlwa.gov.uk/reducereuserecycle/recycle/whatcanwerecycle/pens,"pens, marker pens, felt tip pens, highlighters, stationary, highlighter","We can't recycle pens so please put them in your general waste. Alternatively, any brand of pen, correction fluid pots, markers and highlighters can be recycled through TerraCycle where there are a number of drop-off locations. See their website page for more information."
Perfume bottles,https://www.nlwa.gov.uk/reducereuserecycle/recycle/whatcanwerecycle/perfume-bottles,perfume bottles,All colours of glass can be recycled at home. Please just ensure that bottles are empty.
Pet food,https://www.nlwa.gov.uk/reducereuserecycle/recycle/whatcanwerecycle/pet-food,pet food,"If your local council provides a food waste collection service where you live, you can dispose of pet food in your food bin. All types of food can go in the bin but please do not add: any kind of plastic or packaging, liquids including liquid fat/oil, and garden waste including wood or cut flowers. If you do not have a food waste service, the pet food would need to go in your general waste bin."
Petrol,https://www.nlwa.gov.uk/reducereuserecycle/recycle/whatcanwerecycle/petrol,petrol,A small quantity of petrol can be put in the oil container at a north London reuse and recycling centre (RRC). If you need to dispose of more than 5 litres you will need to use the free City of London Hazardous Waste Service.
Pillows,https://www.nlwa.gov.uk/reducereuserecycle/recycle/whatcanwerecycle/pillows,pillows,Duvets and pillows unfortunately cannot be recycled and would need to be taken to a reuse and recycling centre (RRC).
Pipes,https://www.nlwa.gov.uk/reducereuserecycle/recycle/whatcanwerecycle/pipes,pipes,"DIY waste from your household can be taken to one of north London's reuse and recycling centres (RRC) where it can be separated and recycled. Alternatively, you could make use of your local council's bulky collection service."
Pizza boxes,https://www.nlwa.gov.uk/reducereuserecycle/recycle/whatcanwerecycle/pizza-boxes,pizza boxes,"The specification for the Materials Recovery Facilities (MRFs), which sort north Londoners’ recycling into the different individual materials includes pizza boxes as long as they are not heavily contaminated with grease or food. As most pizza boxes are likely to have oily residue, our current guidance says that they should not be included - paper/card stained with grease is listed under the ‘no’ section. However, we will shortly be updating this guidance because a small amount of grease is not a problem and as long as any separate polystyrene tray inserts are removed, pizza boxes can be recycled along with any other cardboard in the recycling.  The reason that cardboard contaminated with food and grease is a problem is because the food cannot easily be removed, so it means that when the cardboard goes for recycling it contains cardboard and food - manufacturers don’t want their cardboard to be mixed up with bits of old food. A lot of grease is a problem because it makes the fibres in the cardboard stick together so that it is more difficult for the cardboard manufacturers to separate the individual fibres for making into new cardboard."
Plasterboard,https://www.nlwa.gov.uk/reducereuserecycle/recycle/whatcanwerecycle/plasterboard-0,plasterboard,This must be separated from other waste as it contains gypsum. You can take it to a north London's reuse and recycling centres (RRC) but just check with the site before going as they do not all accept plasterboard. Alternatively you could enquire with your local council whether they accept plasterboard as part of the bulky waste collection service.
Plastic bottle triggers/pumps,https://www.nlwa.gov.uk/reducereuserecycle/recycle/whatcanwerecycle/plastic-bottle-triggerspumps,plastic bottle triggers,"These can be recycled at home. Empty and rinse well, labels can be left on.Pumps and triggers on plastic bottles are likely to be a different material to the plastic bottle so, ideally, we would ask people to remove these so they are separated from the bottle. However, if the triggers/pumps remain attached to the bottles many will pop-off during processing, so will be removed that way. In addition, in some cases the recycling will go first to the Materials Recovery Facilities (MRFs), for sorting into the different individual materials, but the plastics may then go on to a second sorting plant called a plastics recovery facility (PRF) for further sorting and they will then be extracted there."
Plastic bottles,https://www.nlwa.gov.uk/reducereuserecycle/recycle/whatcanwerecycle/plastic-bottles,"plastic bottles, cosmetics bottles","These can be recycled at home. Empty and rinse well, remove cardboard packaging but labels can be left on"
Plastic bottles containing chemicals,https://www.nlwa.gov.uk/reducereuserecycle/recycle/whatcanwerecycle/plastic-bottles-containing-chemicals,plastic bottles chemicals,Plastic bottles containing strong chemicals that are highly poisonous are hazardous to staff and can damage the recycling equipment. Check the bottle for disposal instructions or use the free City of London Hazardous Waste Service.
Plastic cups,https://www.nlwa.gov.uk/reducereuserecycle/recycle/whatcanwerecycle/plastic-cups,plastic cups,"The end market for these types of products has never been very reliable, so the Materials Recovery Facilities which sort the recycling into different individual materials don’t want single-use plastic cutlery, plates and cups because they are unlikely to be able to sell them so that they can be made into new products."
Plastic milk bottles,https://www.nlwa.gov.uk/reducereuserecycle/recycle/whatcanwerecycle/plastic-milk-bottles,milk bottles,"These can be recycled at home. Empty and rinse well, remove cardboard packaging but labels can be left on."
Plastic pots,https://www.nlwa.gov.uk/reducereuserecycle/recycle/whatcanwerecycle/plastic-pots,plastic pots,These can be recycled at home. Please just give them a quick rinse to make sure there is no food left inside. Remove film lids and any cardboard packaging but labels can be left on.
Plastic trays,https://www.nlwa.gov.uk/reducereuserecycle/recycle/whatcanwerecycle/plastic-trays,plastic trays,"These can be recycled at home. Please just give them a quick rinse to make sure there is no food left inside. Remove film lids, absorbent pads and any cardboard packaging but labels can be left on."
Plastic tubs,https://www.nlwa.gov.uk/reducereuserecycle/recycle/whatcanwerecycle/plastic-tubs,plastic tubs,These can be recycled at home. Please just give them a quick rinse to make sure there is no food left inside. Remove film lids and any cardboard packaging but labels can be left on.
Plate scrappings,https://www.nlwa.gov.uk/reducereuserecycle/recycle/whatcanwerecycle/plate-scrappings,plate scrapings,"If your local council provides a food waste collection service where you live, you can dispose of food waste in your food bin. All types of food can go in the bin but please do not add: any kind of plastic or packaging, liquids including liquid fat/oil, and garden waste including wood or cut flowers. If you do not have a food waste service, cooked foods like this would need to go in your general waste bin - or if you have space, subsidised home composters or wormeries can be purchased from your local council, enabling you to dispose of organic waste like fruit and vegetable peel."
Polystyrene,https://www.nlwa.gov.uk/reducereuserecycle/recycle/whatcanwerecycle/polystyrene,Polystyrene,"Polystyrene is very cheap to produce but recycling it would require a lot of energy, meaning that it is not worth it. Put it in your general waste."
Post-it notes,https://www.nlwa.gov.uk/reducereuserecycle/recycle/whatcanwerecycle/post-it-notes,post it notes,"Although these are made from paper, they also contain adhesive to make them sticky so are not recyclable. Please put them in your general waste."
Postage stamps,https://www.nlwa.gov.uk/reducereuserecycle/recycle/whatcanwerecycle/postage-stamps,postage stamps,"Many charities accept used stamps as they can benefit from reusing them. Alternatively, they can be left on mailed items and placed in your household recycling."
Pottery,https://www.nlwa.gov.uk/reducereuserecycle/recycle/whatcanwerecycle/pottery,pottery,"If they're in good condition, ceramics/pottery/earthenware could be sold online, taken to a charity shop or given away on Freecycle or Freegle. If broken or not in good condition, they can be taken to one of north London's reuse and recycling centres (RRC)"
Printer cartridges,https://www.nlwa.gov.uk/reducereuserecycle/recycle/whatcanwerecycle/printer-cartridges,printer cartridges,"There are many charities which welcome unwanted ink cartridges. You can also find local stores who will refill ink cartridges so you can re-use them. Alternatively, you can take them to one of north London's reuse and recycling centres (RRC)."
Printers,https://www.nlwa.gov.uk/reducereuserecycle/recycle/whatcanwerecycle/printers,printers,"If you have a household electrical item that is in good condition, it could be sold or donated for reuse or to charity. If the items is not reusable, it can be taken to one of north London's reuse and recycling centres (RRC) or make use of your local council's bulky collection service. If it is smaller than 520mm x 510mm you can place it one of the small Waste Electrical and Electronic (WEEE) banks around north London.Or for information about how to dispose of larger electrical, including a free collection from Clearabee, visit our page about recycling electrical items."
Projectors,https://www.nlwa.gov.uk/reducereuserecycle/recycle/whatcanwerecycle/projectors,projectors,"If you have a household electrical item that is in good condition, it could be sold or donated for reuse or to charity. If the item is not reusable, it can be taken to one of north London's reuse and recycling centres (RRC) or if it is smaller than 520mm x 510mm you can place it one of the small Waste Electrical and Electronic (WEEE) banks around north London. Or for information about how to dispose of larger electrical, including a free collection from Clearabee, visit our page about recycling electrical items."
Punnets,https://www.nlwa.gov.uk/reducereuserecycle/recycle/whatcanwerecycle/punnets,punnets,"These can be recycled at home. Please just give them a quick rinse to make sure there is no food left inside. Remove film lids, absorbent pads and any cardboard packaging but labels can be left on."
Pyrex,https://www.nlwa.gov.uk/reducereuserecycle/recycle/whatcanwerecycle/pyrex,pyrex,"Pyrex products cannot be accepted for recycling because the type of glass used in microwave plates, pyrex and plate glass melts at a different temperature from the glass used for bottles and jars. This means that if the plate, pyrex or microwave glass is mixed with bottle and jar glass it causes imperfections in the end product. If plate glass or pyrex enters the glass recycling process it can result in new containers being rejected. It is therefore not something that either the smelting plant or the manufacturers want and it should therefore not be included in your recycling."
Radios,https://www.nlwa.gov.uk/reducereuserecycle/recycle/whatcanwerecycle/radios,radio,"Small electrical items that are in good condition could be sold or donated for reuse or to charity. If the item is not reusable, it can be taken to one of north London's reuse and recycling centres (RRC) or if it is smaller than 520mm x 510mm you can place it one of the small Waste Electrical and Electronic (WEEE) banks around north London. For more information visit our page about recycling electrical items."
Rags,https://www.nlwa.gov.uk/reducereuserecycle/recycle/whatcanwerecycle/rags,rags,Old used fabric like rags can be taken to an on-street collection bank or to a reuse and recycling centre (RRC) where it will be sorted and recycled.
Raw fish,https://www.nlwa.gov.uk/reducereuserecycle/recycle/whatcanwerecycle/raw-fish,raw fish,"If your local council provides a food waste collection service where you live, you can dispose of food waste in your food bin. All types of food can go in the bin but please do not add: any kind of plastic or packaging, liquids including liquid fat/oil, and garden waste including wood or cut flowers. If you do not have a food waste service, the food would need to go in your general waste bin."
Raw meat,https://www.nlwa.gov.uk/reducereuserecycle/recycle/whatcanwerecycle/raw-meat,raw meat,"If your local council provides a food waste collection service where you live, you can dispose of food waste in your food bin. All types of food can go in the bin but please do not add: any kind of plastic or packaging, liquids including liquid fat/oil, and garden waste including wood or cut flowers. If you do not have a food waste service, the food would need to go in your general waste bin."
Records,https://www.nlwa.gov.uk/reducereuserecycle/recycle/whatcanwerecycle/records,records,"Records that are in good condition can be sold or given away online or donated to charity. However if the record is not in good condition, they cannot be recycled so would need to go in your general waste."
Rice,https://www.nlwa.gov.uk/reducereuserecycle/recycle/whatcanwerecycle/rice,rice,"If your local council provides a food waste collection service where you live, you can dispose of food waste in your food bin. All types of food can go in the bin but please do not add: any kind of plastic or packaging, liquids including liquid fat/oil, and garden waste including wood or cut flowers. If you do not have a food waste service, cooked foods like this would need to go in your general waste bin - or if you have space, subsidised home composters or wormeries can be purchased from your local council, enabling you to dispose of organic waste like fruit and vegetable peel."
Rugs,https://www.nlwa.gov.uk/reducereuserecycle/recycle/whatcanwerecycle/rugs,rugs,"Household items that are in good condition could be sold or donated for reuse or to charity. If the item cannot be reuse, you can dispose of this at one of north London's reuse and recycling centres (RRC) or make use of your local council's bulky collection service."
Rulers,https://www.nlwa.gov.uk/reducereuserecycle/recycle/whatcanwerecycle/rulers,rulers,"We can't recycle plastic rulers so please put them in your general waste. A metal ruler could be sold or donated for reuse or to charity. Alternatively, take it to one of north London's reuse and recycling centres (RRC) to be recycled."
Sanitary products,https://www.nlwa.gov.uk/reducereuserecycle/recycle/whatcanwerecycle/sanitary-products,sanitary products,"Sanitary products are made from a combination of natural and synthetic materials. For this reason and for hygiene reasons, they cannot be recycled and should go in the general waste (not flushed down the toilet)."
Sat navs,https://www.nlwa.gov.uk/reducereuserecycle/recycle/whatcanwerecycle/sat-navs,sat navs,"Small electrical items that are in good condition could be sold or donated for reuse or to charity. If the item is not reusable, it can be taken to one of north London's reuse and recycling centres (RRC) or if it is smaller than 520mm x 510mm you can place it one of the small Waste Electrical and Electronic (WEEE) banks around north London."
Saucepans,https://www.nlwa.gov.uk/reducereuserecycle/recycle/whatcanwerecycle/saucepans,saucepans,"Saucepans that are in good condition could be sold or donated for reuse or to charity. If the item is not reusable, it can be taken to one of north London's reuse and recycling centres (RRC) where it can be recycled."
School equipment,https://www.nlwa.gov.uk/reducereuserecycle/recycle/whatcanwerecycle/school-equipment,school,"Community Recycle is a scheme established by companies operating within the external school environment sector. They collect, coordinate and donate overstocked, unsellable items, returned goods and second-hand equipment to schools in across the UK. Goods that would otherwise be left in storage or sent for disposal are put to good use in the community, saving schools money and brightening up school grounds across the UK. The types of material on offer include:polycarbonate sheetsshade sailspost padsoutdoor furniture itemsYou will find more information for the scheme on the Community Recycle website."
School uniforms,https://www.nlwa.gov.uk/reducereuserecycle/recycle/whatcanwerecycle/school-uniforms,school uniform,"Ask if the school offers a take-back scheme. This allows parents to purchase pre-worn uniform at a reduced price. If there is no take-back scheme, consider setting one up with other parents, or ask the school for advice. They may be happy for the uniform to be donated to charity or they could even set up a collection point themselves. They can contact their uniform supplier or Local Education Authority for advice. If the uniform is not suitable for reuse, it can be deposited in one of north London's on-street collection banks or taken to a reuse and recycling centre (RRC) where it will be sorted and recycled."
Scrap metal,https://www.nlwa.gov.uk/reducereuserecycle/recycle/whatcanwerecycle/scrap-metal,scrap metal,"This can be recycled at one of north London's reuse and recycling centres (RRC) or take it to any scrap metal merchant. Alternatively, you could make use of your local council's bulky collection service."
Sellotape,https://www.nlwa.gov.uk/reducereuserecycle/recycle/whatcanwerecycle/sellotape,sellotape,Thin adhesive plastic like sticky tape cannot be recycled. Please put it in your general waste.
Sewing machines,https://www.nlwa.gov.uk/reducereuserecycle/recycle/whatcanwerecycle/sewing-machines,sewing machines,"If you have a household electrical item that is in good condition, it could be sold or donated for reuse or to charity. If the item is not reusable, it can be taken to one of north London's reuse and recycling centres (RRC) or if it is smaller than 520mm x 510mm you can place it one of the small Waste Electrical and Electronic (WEEE) banks around north London.Or for information about how to dispose of larger electrical, including a free collection from Clearabee, visit our page about recycling electrical items."
Shampoo bottles,https://www.nlwa.gov.uk/reducereuserecycle/recycle/whatcanwerecycle/shampoo-bottles,shampoo bottles,"These can be recycled at home. Empty and rinse well, remove cardboard packaging but labels can be left on."
Shoes,https://www.nlwa.gov.uk/reducereuserecycle/recycle/whatcanwerecycle/shoes,shoes,"If they're in good condition, shoes could be sold online, taken to a charity shop or given away on Freecycle or Freegle. Alternatively, if they are not in good condition, they can be deposited in one of north London's on-street collection banks or taken to a reuse and recycling centre (RRC)."
Shredded paper,https://www.nlwa.gov.uk/reducereuserecycle/recycle/whatcanwerecycle/shredded-paper,shredded paper,"Shredded paper is included in the specification for the Materials Recovery Facilities (MRFs), which sort north Londoners’ recycling into the different individual materials. Please put your shredded paper in the recycling but please place it in a paper envelope before putting it in with the rest of the material. This is so that it doesn’t blow around everywhere when picked up or go everywhere in the MRF.For more information see: https://www.recyclenow.com/what-to-do-with/paper-0"
Sideboards,https://www.nlwa.gov.uk/reducereuserecycle/recycle/whatcanwerecycle/sideboards,sideboards,"These can be recycled at one of north London's reuse and recycling centres (RRC). Alternatively, you could make use of your local council's bulky collection service."
