Electronic games,https://www.nlwa.gov.uk/reducereuserecycle/recycle/whatcanwerecycle/electronic-games,electronic games,"Small electrical items that are in good condition could be sold or donated for reuse or to charity. If the items is not reusable, it can be taken to an on-street electricals collection bank or to one of north London's reuse and recycling centres (RRC) to be recycled. For more information visit our page about recycling electrical items."
Energy saving lightbulbs,https://www.nlwa.gov.uk/reducereuserecycle/recycle/whatcanwerecycle/energy-saving-lightbulbs,energy saving lightbulbs,"Older style 'incandescent' bulbs aren't recyclable and should be thrown away in your rubbish bin. Energy efficient light bulbs are a type of fluorescent lamp and can be recycled at one of north London's reuse and recycling centres (RRCs), or find other recycling points."
Engine oil,https://www.nlwa.gov.uk/reducereuserecycle/recycle/whatcanwerecycle/engine-oil,engine oil,Used engine oil discarded down storm drains can cause considerable environmental damage if it leaches into watercourses and/or groundwater. Take it to one of north London's reuse and recycling centres (RRC) where it can be recycled.
Engine oil container,https://www.nlwa.gov.uk/reducereuserecycle/recycle/whatcanwerecycle/engine-oil-container,engine oil container,"Empty metal containers can be taken to one of north London's reuse and recycling centres where they can be recycled. However if the container is made from plastic, it cannot be recycled and should be placed in your general waste."
Envelopes,https://www.nlwa.gov.uk/reducereuserecycle/recycle/whatcanwerecycle/envelopes,envelopes,"These can be recycled at home. Please just make sure they have no dirt, foodstuffs, grease or paint on them."
Erasers,https://www.nlwa.gov.uk/reducereuserecycle/recycle/whatcanwerecycle/erasers,erasers,We can't recycle erasers so please put them in your general waste.
Expanded polystyrene,https://www.nlwa.gov.uk/reducereuserecycle/recycle/whatcanwerecycle/expanded-polystyrene,expanded polystyrene,"Polystyrene is very cheap to produce but recycling it would require a lot of energy, meaning that it is not worth it. Put it in your general waste."
Fabrics,https://www.nlwa.gov.uk/reducereuserecycle/recycle/whatcanwerecycle/fabrics,"fabrics, textiles, fabric scraps,","Fabric in good condition could be sold online, given away to or donated to charity. Alternatively, it can be deposited in one of north London's on-street collection banks or taken to a reuse and recycling centre (RRC) where it will be sorted and recycled."
Face cream jars,https://www.nlwa.gov.uk/reducereuserecycle/recycle/whatcanwerecycle/face-cream-jars,face cream jars,"Glass face cream jars (of all colours) can be recycled at home. Please just ensure that jars are empty. Plastic face cream jars are made out of multiple materials or hard plastic such PVC which can not be recycled, so they should be placed in the general waste bin."
Fat,https://www.nlwa.gov.uk/reducereuserecycle/recycle/whatcanwerecycle/fat,"fat, cooking oil","Small quantities of hard fat can be added to your household food bin, if you have a collection. Alternatively, liquid fat can be taken to one of north London's reuse and recycling centres (RRC) . Once cooled, simply collect it in a plastic or glass bottle, and check which RRC to go to (they do not all accept fat). Once collected, the oil will be converted into high quality bio-fuel for the distribution and power-generation industries. Old cooking oil can also be composted at home but just make sure it's mixed well with paper or cardboard first."
Film lids,https://www.nlwa.gov.uk/reducereuserecycle/recycle/whatcanwerecycle/film-lids,film lids,Thin plastic wrapping like this is made from low-quality plastic which could be contaminated with food so it is not recycled. Please put it in your general waste.
Fire alarms,https://www.nlwa.gov.uk/reducereuserecycle/recycle/whatcanwerecycle/fire-alarms,fire alarms,"Small electrical items that are in good condition could be sold or donated for reuse or to charity. If the items is not reusable, it can be taken to an on-street electricals collection bank or to one of north London's reuse and recycling centres (RRC) to be recycled. For more information visit our page about recycling electrical items."
Fire extinguishers,https://www.nlwa.gov.uk/reducereuserecycle/recycle/whatcanwerecycle/fire-extinguishers,fire extinguishers,Fire extinguishers should be taken to a reuse and recycling centre (RRC) where they can be disposed of.
Fish bones,https://www.nlwa.gov.uk/reducereuserecycle/recycle/whatcanwerecycle/fish-bones,fish bones,"If your local council provides a food waste collection service where you live, you can dispose of food waste in your food bin. All types of food can go in the bin but please do not add: any kind of plastic or packaging, liquids including liquid fat/oil, and garden waste including wood or cut flowers. If you do not have a food waste service, the bones would need to go in your general waste bin."
Fluorescent tubes,https://www.nlwa.gov.uk/reducereuserecycle/recycle/whatcanwerecycle/fluorescent-tubes,Fluorescent tubes,Fluorescent tubes can be recycled at one of north London's reuse and recycling centres (RRCs).
Flyers,https://www.nlwa.gov.uk/reducereuserecycle/recycle/whatcanwerecycle/flyers,"flyers, junk mail","These can be recycled at home. Please just make sure they have no dirt, foodstuffs, grease or paint on them."
Foam chips,https://www.nlwa.gov.uk/reducereuserecycle/recycle/whatcanwerecycle/foam-chips,foam chips,"Polystyrene is very cheap to produce but recycling it would require a lot of energy, meaning that it is not worth it. Place it in your general waste."
Foil blister packs,https://www.nlwa.gov.uk/reducereuserecycle/recycle/whatcanwerecycle/foil-blister-packs,foil blister packs,"Blister packs are made from plastic and aluminium, stuck together. They are not currently recyclable so should go in your general waste."
Foil trays,https://www.nlwa.gov.uk/reducereuserecycle/recycle/whatcanwerecycle/foil-trays,foil trays,Foil can be recycled as long as it does not have any food residue or grease on it.
Food,https://www.nlwa.gov.uk/reducereuserecycle/recycle/whatcanwerecycle/food,mouldy food,"if your local council provides a food waste collection service where you live, this can be added to your food waste bin. Find out more about food waste collection services by visiting the food waste recycling information page.Items that can be recycled All uneaten and leftover food and plate scrapings Tea bags and coffee grounds Out of date or mouldy food, removed from packaging Raw and cooked meat, including bones and chicken carcasses Raw and cooked fish, including bones Dairy products such as cheese, but nothing liquid, like milk Eggs and egg shells Rice, pasta, beans and noodles Baked goods such as bread, biscuits, cakes and pastries Fruit and vegetables, including raw and cooked vegetables, peelings, skins and fruit stones Pet food Items that cannot be recycled Non-food products, including nappies (even if biodegradable) Packaging of any kind Any material that is not food waste, including paper such as tissue paper, newspaper and card Liquids such as milk - these may leak, causing spillages when transporting the food waste Oil and liquid fat Plastic bags or film Garden waste, including wood and cut flowers"
Food bags,https://www.nlwa.gov.uk/reducereuserecycle/recycle/whatcanwerecycle/food-bags,"plastic wrapping, salad bag, salad bags, potato bag, potato bags","Plastic bags which hold things like bread, potatoes or salad cannot be recycled. This is partly because they are made from low-quality plastic but also because they might be dirty with leftover food. Please put them in your general waste."
Food blenders,https://www.nlwa.gov.uk/reducereuserecycle/recycle/whatcanwerecycle/food-blenders,food blenders,"If you have a household electrical item that is in good condition, it could be sold or donated for reuse or to charity. If the item is not reusable, it can be taken to one of north London's reuse and recycling centres (RRC) or if it is smaller than 520mm x 510mm you can place it one of the small Waste Electrical and Electronic (WEEE) banks around north London. For more information visit our page about recycling electrical items."
Food mixers,https://www.nlwa.gov.uk/reducereuserecycle/recycle/whatcanwerecycle/food-mixers,food mixers,"If you have a household electrical item that is in good condition, it could be sold or donated for reuse or to charity. If the item is not reusable, it can be taken to one of north London's reuse and recycling centres (RRC) or if it is smaller than 520mm x 510mm you can place it one of the small Waste Electrical and Electronic (WEEE) banks around north London. Or for information about how to dispose of larger electrical, including a free collection from Clearabee, visit our page about recycling electrical items."
Food pouches,https://www.nlwa.gov.uk/reducereuserecycle/recycle/whatcanwerecycle/food-pouches,"baby food pouches, pet food pouches, plastic food pouches","Laminated food pouches are made from a combination of aluminium and plastic. We do not have the technology to recycle them in north London. Some laminated pouches can be recycled through TerraCycle: https://www.terracycle.com/en-GB/brigades/ellacycle. Alternatively, please put them in your general waste."
Food tins and drinks cans,https://www.nlwa.gov.uk/reducereuserecycle/recycle/whatcanwerecycle/food-tins-and-drinks-cans,food and drinks cans,"Food tins and drink cans can be recycled at home. Please just give them a quick rinse to make sure there is no food residue. You can leave the label on but do not crush or flatten. Items that can be recycledDrinks cans Food tins Empty aerosols (please remove plastic caps) Jar lids Clean foil and foil trays Items that cannot be recycled  General kitchenware e.g. cutlery, pots and pans Crisp and sweet packets/wrappers (some manufacturers, such as Walkers, offer a free recycling scheme. TerraCycle has a number of drop-off points where crisp packets and biscuit wrappers can be recycled). Laminated plastic food/drink pouches e.g. baby food, cat food, or coffee pouches (but some of these can be recycled through TerraCycle) Metal containers for chemicals e.g. white spirits, paints, or engine oils (but empty paint paint containers can be recycled at your local reuse and recycling centre) Any other metal items e.g. kettles, irons, pipes, white goods (visit our electrical and electronic items page to find out how to recycle electrical items. Metal pipes and wire coat hangers can be recycled at your local reuse and recycling centre)"
Food waste,https://www.nlwa.gov.uk/reducereuserecycle/recycle/whatcanwerecycle/food-waste,Food waste,"If your local council provides a food waste collection service where you live, this can be added to your food waste bin. Find out more about food waste collection services by visiting the food waste recycling information page. Items that can be recycled . All uneaten and leftover food and plate scrapings Tea bags and coffee grounds Out of date or mouldy food, removed from packaging Raw and cooked meat, including bones and chicken carcasses Raw and cooked fish, including bones Dairy products such as cheese, but nothing liquid, like milk Eggs and egg shells Rice, pasta, beans and noodles Baked goods such as bread, biscuits, cakes and pastries Fruit and vegetables, including raw and cooked vegetables, peelings, skins and fruit stones Pet food Items that cannot be recycled Non-food products, including nappies (even if biodegradable) Packaging of any kind Any material that is not food waste, including paper such as tissue paper, newspaper and card Liquids such as milk - these may leak, causing spillages when transporting the food waste Oil and liquid fat Plastic bags or film Garden waste, including wood and cut flowers"
Food waste from the garden,https://www.nlwa.gov.uk/reducereuserecycle/recycle/whatcanwerecycle/food-waste-garden,food waste from garden,"If you have surplus food from your garden, why not see if you can give it away to friends and neighbours. If the food is inedible, you could compost it yourself or, if your local council provides a food waste collection service where you live, you can dispose of food waste in your food bin. Please note that food waste from the garden should not be disposed of in your garden waste bin."
Foreign currency,https://www.nlwa.gov.uk/reducereuserecycle/recycle/whatcanwerecycle/foreign-currency,foreign currency,Foreign coins and out of date British currency can be taken to your local charity shop. Many banks will collect them too - ask your local branch for details.
Fridges and freezers,https://www.nlwa.gov.uk/reducereuserecycle/recycle/whatcanwerecycle/fridges-and-freezers,fridges and freezers,"If large electrical appliances are in good condition, they could be sold or donated for reuse or to charity. Some local authorities and charities might even collect reusable items from your home. If the item is not reusable, there are lots of ways to recycle it, some boroughs offer a free collection through Clearabee - visit our page about recycling electrical items(opens in a new window) check with your council."
Fruit punnets,https://www.nlwa.gov.uk/reducereuserecycle/recycle/whatcanwerecycle/fruit-punnets,fruit punnets,"These can be recycled at home. Please just give them a quick rinse to make sure there is no food left inside. Remove film lids, absorbent pads and any cardboard packaging but labels can be left on."
Fruits,https://www.nlwa.gov.uk/reducereuserecycle/recycle/whatcanwerecycle/fruits,fruits,"If your local council provides a food waste collection service where you live, you can dispose of food waste in your food bin. All types of food can go in the bin but please do not add: any kind of plastic or packaging, liquids including liquid fat/oil, and garden waste including wood or cut flowers. If you do not have a food waste services, food would have to go in your general waste bin - or if you have space, subsidised home composters or wormeries can be purchased from your local council, enabling you to dispose of organic waste like fruit and vegetable peel."
Frying pans,https://www.nlwa.gov.uk/reducereuserecycle/recycle/whatcanwerecycle/frying-pans,"frying pans, pans, Teflon","Frying pans that are in good condition could be sold or donated for reuse or to charity. If the item is not reusable, it can be taken to one of north London's reuse and recycling centres (RRC) where it can be recycled. Please do not put in your recycling bin since it can damage the equipment or injure the staff."
Furniture,https://www.nlwa.gov.uk/reducereuserecycle/recycle/whatcanwerecycle/furniture,furniture,"If furniture is in good condition, it could be sold or donated for reuse or to charity. Some local authorities and charities might even collect reusable items from your home. Please note that any furniture containing upholstery needs to have a fire label on it, or it cannot be reused (see Reuse Network website page) If the item is not reusable, you could take it to one of north London's reuse and recycling centres (RRC) or make use of your local council's bulky collection service."
Garden chemicals,https://www.nlwa.gov.uk/reducereuserecycle/recycle/whatcanwerecycle/garden-chemicals,garden chemicals,This is classed as 'hazardous' waste so should be disposed of carefully. You will need to use the free City of London Hazardous Waste Service.
Garden tools,https://www.nlwa.gov.uk/reducereuserecycle/recycle/whatcanwerecycle/garden-tools,garden tools,"You might also be able to sell or give tools away online. However, if you have broken tools, these can be taken to a reuse and recycling centre (RRC) where the metal can be recycled."
Garden Waste,https://www.nlwa.gov.uk/reducereuserecycle/recycle/whatcanwerecycle/garden-waste,garden waste,"If your local council provides a garden waste collection service where you live, this can be added to your garden waste bin. Find out more about garden waste collection services by visiting the garden waste recycling information page. You can also take garden waste to your local reuse and recycling centre.  Items that can be recycled Leaves and flowers Grass and weeds Tree bark and pruned branches Clippings and twigs Logs up to 30cm (12 inches) in diameter or 2m (79 inches) in length Cut flowers and household plants  Items that cannot be recycledInvasive species such as Japanese Knotweed. For further guidance, please visit www.gov.uk/guidance/prevent-the-spread-of-harmful-invasive-and-non-native-plants Plastic bags and black sacks Compostable packaging Any painted or treated wood Soil and turf Stones, rubble, plant pots and bricks Animal/pet waste, including faeces, bedding and litter Logs exceeding 30cm (12 inches) in diameter or 2m (79 inches) in length Food waste Any other non-garden waste, including paper, card, textiles, plastics, metals and nappies (even if biodegradable)"
Gas bottles,https://www.nlwa.gov.uk/reducereuserecycle/recycle/whatcanwerecycle/gas-bottles,gas bottles,These should be returned to the issuing company. Their address is usually shown on the label on the cylinder.
General waste,https://www.nlwa.gov.uk/reducereuserecycle/recycle/whatcanwerecycle/general-waste,"domestic waste, general waste, black bin, rubbish",Your local council is responsible for the collection of your domestic waste. Contact your council to find out what arrangements are in place at your address and what day your rubbish is collected.
Gift wrap,https://www.nlwa.gov.uk/reducereuserecycle/recycle/whatcanwerecycle/gift-wrap,"gift wrap, wrapping paper,","As long as it is not shiny and has no glitter on it, gift paper can be recycled. Shiny/glittery paper should go in the general waste bin. If you are unsure, do the 'scrunch test': scrunch the paper in your hand and if it remains scrunched, it's okay to recycle (but if it bounces back, put it in the general waste bin)."
Glass cookware,https://www.nlwa.gov.uk/reducereuserecycle/recycle/whatcanwerecycle/glass-cookware,"glass cookware, Pyrex,","These types of glass products cannot be accepted for recycling because the type of glass used in microwave plates, pyrex and plate glass melts at a different temperature from the glass used for bottles and jars. This means that if the plate, pyrex or microwave glass is mixed with bottle and jar glass it causes imperfections in the end product. If plate glass or pyrex enters the glass recycling process it can result in new containers being rejected. It is therefore not something that either the smelting plant or the manufacturers want and it should therefore not be included in your recycling."
Glasses (spectacles),https://www.nlwa.gov.uk/reducereuserecycle/recycle/whatcanwerecycle/glasses-spectacles,glass spectacles,Some opticians and charity shops will accept old glasses for repair and shipment to developing countries.
Hair straighteners,https://www.nlwa.gov.uk/reducereuserecycle/recycle/whatcanwerecycle/hair-straighteners,hair straighteners,"Small electrical items that are in good condition could be sold or donated for reuse or to charity. If the item is not reusable, it can be taken to one of north London's reuse and recycling centres (RRC) or if it is smaller than 520mm x 510mm you can place it one of the small Waste Electrical and Electronic (WEEE) banks around north London. For more information visit our page about recycling electrical items."
Hairdryers,https://www.nlwa.gov.uk/reducereuserecycle/recycle/whatcanwerecycle/hairdryers,hairdryers,"Small electrical items that are in good condition could be sold or donated for reuse or to charity. If the item is not reusable, it can be taken to one of north London's reuse and recycling centres (RRC) or if it is smaller than 520mm x 510mm you can place it one of the small Waste Electrical and Electronic (WEEE) banks around north London."
Hand Sanitiser Bottle,https://www.nlwa.gov.uk/reducereuserecycle/recycle/whatcanwerecycle/hand-sanitiser-bottle,"antibacterial gel bottle, handgel bottle, handsan bottle, hand sanitiser","These can be recycled at home. Empty and rinse well, labels can be left on."
Hard Plastic,https://www.nlwa.gov.uk/reducereuserecycle/recycle/whatcanwerecycle/hard-plastic,"plastic toys, hard plastics","Hard plastic items that are in good condition could be sold or donated for reuse or to charity. We cannot currently recycle hard plastic in north London so if the item is not reusable, it can be disposed of in your general waste bin."
Hardcore and rubble,https://www.nlwa.gov.uk/reducereuserecycle/recycle/whatcanwerecycle/hardcore-and-rubble,"hardcore and rubble, hardcore, rubble","Hardcore can be taken to one of north London's reuse and recycling centres (RRC) where it can be recycled. Each north London household can take up to six standard rubble sacks of soil/rubble to an RRC each month. This includes concrete, brick, stones, pebbles, soil, sand and gravel. A standard rubble sack is 51cm by 76cm (20 inches by 30 inches) or equivalent. If you have a large quantity of hardcore material, consider hiring a skip."
Hazardous waste,https://www.nlwa.gov.uk/reducereuserecycle/recycle/whatcanwerecycle/hazardous-waste,hazardous waste,"Depending on what type of hazardous waste you have, you may be able to take it to a north London reuse and recycling centre, or use the free City of London Hazardous Waste Service. Use our A-Z waste items page to search by the type of hazardous waste you want to dispose of."
Headache pills,https://www.nlwa.gov.uk/reducereuserecycle/recycle/whatcanwerecycle/headache-pills,"headache pills, medicine","Medicines and tablets are classed as hazardous waste. Unopened, unused and out-of-date medicines can be returned to pharmacies for disposal. Opened medicines should go in your general waste (never flushed down the toilet). Inhalers are recyclable at participating pharmacies."
Hearing aids,https://www.nlwa.gov.uk/reducereuserecycle/recycle/whatcanwerecycle/hearing-aids,hearing aids,"Hearing aids can be collected for charity at some doctors surgeries, hospital audioloy departments, private hearing specialists or charity shops (e.g. Help the Aged and Age Concern). The hearing aids are repaired, refurbished and sent overseas for reuse in developing countries. Batteries for hearing aids are also wanted."
Hedge trimmers,https://www.nlwa.gov.uk/reducereuserecycle/recycle/whatcanwerecycle/hedge-trimmers,hedge trimmers,"If you have a household electrical item that is in good condition, it could be sold or donated for reuse or to charity. If the items is not reusable, it can be taken to one of north London's reuse and recycling centres (RRC) or make use of your local council's bulky collection service. For more information visit our page about recycling electrical items or book a Clearabee home collection."
Household plants,https://www.nlwa.gov.uk/reducereuserecycle/recycle/whatcanwerecycle/household-plants,household plants,"If your local council provides a garden waste collection service where you live, these can be added to your garden waste bin. Please make sure you do not add plastic bags, soil, turf, stones, rubble, plant pots, painted/treated wood, animal faeces, animal litter, food waste, logs over 30cm in diameter or 2m in length, or any invasive species such as Japanese Knotweed."
Ibuprofen blister packs,https://www.nlwa.gov.uk/reducereuserecycle/recycle/whatcanwerecycle/ibuprofen-blister-packs,ibuprofen blister packs,"Blister packs are made from plastic and aluminium, stuck together. They are not currently recyclable so should go in your general waste."
Ice cream tubs,https://www.nlwa.gov.uk/reducereuserecycle/recycle/whatcanwerecycle/ice-cream-tubs,ice cream tubs,These can be recycled at home. Please just give them a quick rinse to make sure there is no food left inside. Remove film lids and any cardboard packaging but labels can be left on.
Inhalers,https://www.nlwa.gov.uk/reducereuserecycle/recycle/whatcanwerecycle/inhalers,inhalers,Inhalers can be recycled at participating pharmacies. For more information or to find your nearest pharmacy or visit Complete the cycle.
Ink cartridges and toners,https://www.nlwa.gov.uk/reducereuserecycle/recycle/whatcanwerecycle/ink-cartridges-and-toners,ink cartridges,"There are many charities which welcome unwanted ink cartridges. You can also find local stores who will refill ink cartridges so you can re-use them. Alternatively, you can take them to one of north London's reuse and recycling centres (RRC)."
IPad,https://www.nlwa.gov.uk/reducereuserecycle/recycle/whatcanwerecycle/ipad,ipad,"Small electrical items that are in good condition could be sold or donated for reuse or to charity. If the item is not reusable, it can be taken to one of north London's reuse and recycling centres (RRC) or you can place it one of the small Waste Electrical and Electronic (WEEE) banks around north London. For more information visit our page about recycling electrical items."
IPod,https://www.nlwa.gov.uk/reducereuserecycle/recycle/whatcanwerecycle/ipod,ipod,"Small electrical items that are in good condition could be sold or donated for reuse or to charity. If the item is not reusable, it can be taken to one of north London's reuse and recycling centres (RRC) or you can place it one of the small Waste Electrical and Electronic (WEEE) banks around north London. For more information visit our page about recycling electrical items."
Ironing board,https://www.nlwa.gov.uk/reducereuserecycle/recycle/whatcanwerecycle/ironing-board,ironing board,"Household items that are in good condition could be sold or donated for reuse or to charity. If the item is not reusable, it can be taken to one of north London's reuse and recycling centres (RRC) where the metal can be recycled."
